<?xml version="1.0" encoding="UTF-8"?>
<xs:schema xmlns:xs="http://www.w3.org/2001/XMLSchema">
    <xs:element name="movil">
        <xs:complexType>
            <xs:sequence>
                <xs:element name="contacto" maxOccurs="unbounded">
                    <xs:complexType>
                        <xs:sequence>
                            <xs:element name="nombre" type="xs:string" />
                            <xs:element name="telefono" type="xs:string" />
                            <xs:element name="email" type="xs:string" />
                            <xs:element name="direccion" type="xs:string" />
                        </xs:sequence>
                    </xs:complexType>
                </xs:element>
                <xs:element name="piepagina">
                    <xs:complexType>
                        <xs:sequence>
                            <xs:element name="p" type="xs:string" />
                        </xs:sequence>
                    </xs:complexType>
                </xs:element>
            </xs:sequence>
        </xs:complexType>
    </xs:element>
</xs:schema>